{
  "competencies": {
    "updated": []
  },
  "decisions": [],
  "evidence": [
    {
      "id": "ev-opslens-first-commit-1c795b2",
      "reference": "https://github.com/Minhlike/Opslens/commit/1c795b2 (commit SHA do người học báo cáo; chưa xác minh)",
      "reported_verification": "CLAIMED",
      "type": "commit"
    }
  ],
  "handoff_id": "ho-20261027-opslens-se-start-1",
  "milestone_id": "ms-opslens-se-start",
  "misconceptions": [],
  "next_action": "Hoàn tất hai kiểm thử HEALTHY của Java 02 (300/500 và 500/500), sau đó bắt đầu Java 03 về while.",
  "open_issues": [
    "Java 02: kiểm thử trường hợp HEALTHY 300/500.",
    "Java 02: kiểm thử trường hợp HEALTHY 500/500.",
    "DevOps S56: chờ kết quả Infrastructure Baseline theo baseline đã ghi nhận."
  ],
  "schema_version": 1,
  "source": "chatgpt-primary-tutor",
  "status": "IN_PROGRESS",
  "summary": "Người học báo cáo đã bắt đầu chương trình Software Engineering trên OpsLens và đã cấu hình SSH, tạo rồi push commit đầu tiên 1c795b2 lên Minhlike/Opslens. AgentTutor chỉ lưu tham chiếu; Agent không truy cập hay xác minh repository OpsLens.",
  "timestamp": "2026-10-27T10:01:00+07:00",
  "track_id": "track-foundations"
}
